### ISSUE TITLE
Nothing posting to channel

### ISSUE THREAD

**Issue by Cornloaf** [42wim/csm#1]
I have Mattermost server 3.5.1 and have installed CSM on my proxy server.  I created the incoming webhook and ran the ./csm as follows:

 ./csm -c "Switch Changes" -l 172.0.0.1:514 -m https://server.domain.com/hooks/f3m37yi8p3bp3nujkynofqzdpc
listening on 172.0.0.1:514 using bigbrother and sending to channel Switch Changes on https://server.domain.com/hooks/f3m37yi8p3bp3nujkynofqzdpc

The bot has not joined the channel and none of the changes made to my switches will log.

**Comment by 42wim** [comment]
172.0.0.1:514 will only listen on localhost. You have to specify the same ip address you configged on your switch(es).

**Comment by Cornloaf** [comment]
I tried that before.  Here is my current run:
 ./csm -c "Switch Changes" -l 172.17.12.37:514 -m https://server.domain.com/hooks/f3m37yi8p3bp3nujkynofqzdpc
listening on 172.17.12.37:514 using bigbrother and sending to channel Switch Changes on https://server.domain.com/hooks/f3m37yi8p3bp3nujkynofqzdpc

The relevant output from my switch:

logging host 172.17.12.37
archive
 log config
  logging enable
  notify syslog contenttype plaintext
  hidekeys

**Comment by 42wim** [comment]
OK,  I see the issue.  The channel name has to be actual URL name, like you see in the url when you go to the 'switch changes'  channel.  Should be 'switch-changes' if you accepted the default in mattermost. 

Try running ```./csm -c "switch-changes" -l 172.17.12.37:514 -m https://server.domain.com/hooks/f3m37yi8p3bp3nujkynofqzdpc```

If still nothing run with debug

 ```./csm -dd -c "switch-changes" -l 172.17.12.37:514 -m https://server.domain.com/hooks/f3m37yi8p3bp3nujkynofqzdpc```

And doing on the switch eg

```
conf t
logging host 172.17.12.37
```

And paste output here

**Comment by Cornloaf** [comment]
./csm -dd -c "switch-changes" -l 172.17.12.37:514 -m https://server.domain.com/hooks/f3m37yi8p3bp3nujkynofqzdpc
listening on 172.17.12.37:514 using bigbrother and sending to channel switch-changes on https://server.domain.com/hooks/f3m37yi8p3bp3nujkynofqzdpc

I have configured a port on my switch, I see that it has logged:

Dec 12 14:51:18.031: %PARSER-5-CFGLOG_LOGGEDCMD: User:admin  logged command:!exec: enable
Dec 12 14:51:20.626: %PARSER-5-CFGLOG_LOGGEDCMD: User:admin  logged command:interface GigabitEthernet0/6
Dec 12 14:51:24.506: %PARSER-5-CFGLOG_LOGGEDCMD: User:admin  logged command:switchport access vlan 102
Dec 12 14:51:25.413: %PARSER-5-CFGLOG_LOGGEDCMD: User:admin  logged command:exit
Dec 12 14:51:25.995: %SYS-5-CONFIG_I: Configured from console by admin on vty0 (192.168.23.18)

**Comment by 42wim** [comment]
So no debugging output from csm? 
That means it isn't receiving any syslog messages at all. 

My guess is the traffic isn't reaching 172.17.12.37 or 172.17.12.37 is firewalled. 

Does ```tcpdump -n -i any host 172.17.12.37 and port 514``` give any output when doing a config change?

**Comment by Cornloaf** [comment]
Definitely getting the syslogs.  Should the CSM app stay running after I enter the commands or should I get back to a command prompt?

sudo tcpdump -n -i any host 172.17.12.37 and port 514
[sudo] password for mattermost:
tcpdump: verbose output suppressed, use -v or -vv for full protocol decode
listening on any, link-type LINUX_SLL (Linux cooked), capture size 262144 bytes
15:16:12.386096 IP 172.16.254.89.59125 > 172.17.12.37.514: SYSLOG local7.notice, length: 115
15:16:18.078610 IP 172.16.254.89.59125 > 172.17.12.37.514: SYSLOG local7.notice, length: 112
15:16:18.079655 IP 172.16.254.89.59125 > 172.17.12.37.514: SYSLOG local7.notice, length: 91
15:16:19.688701 IP 172.16.254.89.59125 > 172.17.12.37.514: SYSLOG local7.notice, length: 104

**Comment by 42wim** [comment]
csm should not exit and keep running in the foreground. 

Very strange, could you tell me cisco model + software version?

**Comment by 42wim** [comment]
You do run it as root right? Cause it needs to access < 1024 port in your case. 
Should make that clear in the Readme, if you want to avoid root you'll have to listen on > 1024.  I use 5144 and configure the Cisco side to also use that port :)

**Comment by Cornloaf** [comment]
That did it!  The only thing is that it posted as me in the channel.  Is there a way to change that easily?  Also, is there a way to make this start automatically if this server ever reboots?  I know, I am asking too much but this tool is amazing!

**Comment by 42wim** [comment]
* Enable override username in mattermost,  see https://docs.mattermost.com/developer/webhooks-incoming.html

* for startup I have a systemd unit file. 
```
[Unit]
Description=csm
Wants=network.target
After=network.target

[Service]
ExecStart=/usr/local/bin/csm -c "switch-changes" -l 172.17.12.37:514 -m https://server.domain.com/hooks/f3m37yi8p3bp3nujkynofqzdpc
KillSignal=SIGINT
Restart=on-failure

[Install]
WantedBy=multi-user.target
```

Edit ExecStart for your settings, save it in /etc/systemd/system/csm.service

Run as root (first stop your manual started csm) 

```
systemctl daemon-reload
systemctl start csm
```

**Comment by Cornloaf** [comment]
Amazing support.  Everything seems to be working great now.  Thanks again for the troubleshooting!
